{
  "$schema": "../../../../otel-recipes-schema.json",
  "id": "python.console.traces",
  "languageId": "python",
  "signal": "traces",
  "displayName": "Console App",
  "tags": ["console", "manual"],
  "description": "A python console application instrumented with OpenTelemetry that generates a trace.",
  "sourceRoot": "https://github.com/joaopgrassi/otel-recipes/tree/main/src/python/traces/console",
  "steps": [
    {
      "displayName": "Configure the SDK",
      "order": 1,
      "source": "https://raw.githubusercontent.com/joaopgrassi/otel-recipes/main/src/python/traces/console/app.py"
    }
  ],
  "dependencies": [
    {
      "id": "opentelemetry-api",
      "version": "1.24"
    },
    {
      "id": "opentelemetry-sdk",
      "version": "1.24"
    },
    {
      "id": "opentelemetry-exporter-otlp-proto-grpc",
      "version": "1.24"
    }
  ]
}
