{
  "$schema": "../../../../otel-recipes-schema.json",
  "id": "go.console.traces",
  "languageId": "go",
  "signal": "traces",
  "displayName": "Console App",
  "tags": ["console", "manual"],
  "description": "A go console application instrumented with OpenTelemetry that generates a trace.",
  "sourceRoot": "https://github.com/joaopgrassi/otel-recipes/tree/main/src/go/traces/console",
  "steps": [
    {
      "displayName": "Configure the SDK",
      "order": 1,
      "source": "https://raw.githubusercontent.com/joaopgrassi/otel-recipes/main/src/go/traces/console/app.go"
    }
  ],
  "dependencies": [
    {
      "id": "go.opentelemetry.io/otel",
      "version": "v1.26.0"
    },
    {
      "id": "go.opentelemetry.io/otel/exporters/otlp/otlptrace/otlptracegrpc",
      "version": "v1.26.0"
    },
    {
      "id": "go.opentelemetry.io/otel/sdk",
      "version": "v1.26.0"
    },
    {
      "id": "go.opentelemetry.io/otel/trace",
      "version": "v1.26.0"
    }
  ]
}
