{
  "$schema": "../../../../otel-recipes-schema.json",
  "id": "csharp.console.traces",
  "languageId": "csharp",
  "signal": "traces",
  "displayName": "Console App",
  "tags": ["console", "manual"],
  "description": "A C# console application instrumented with OpenTelemetry that generates a trace.",
  "sourceRoot": "https://github.com/joaopgrassi/otel-recipes/tree/main/src/csharp/traces/console",
  "steps": [
    {
      "displayName": "Configure the SDK",
      "order": 1,
      "source": "https://raw.githubusercontent.com/joaopgrassi/otel-recipes/main/src/csharp/traces/console/App.cs"
    }
  ],
  "dependencies": [
    {
      "id": "OpenTelemetry",
      "version": "1.8.1"
    },
    {
      "id": "OpenTelemetry.Exporter.OpenTelemetryProtocol",
      "version": "1.8.1"
    }
  ]
}
