{
  "$schema": "../../../../otel-recipes-schema.json",
  "id": "java.springbootapi.traces",
  "languageId": "java",
  "signal": "traces",
  "displayName": "Spring Boot API",
  "tags": [],
  "description": "A Spring Boot API instrumented with OpenTelemetry Spring Boot starter that generates a trace when the /helloworld endpoint is called.",
  "sourceRoot": "https://github.com/joaopgrassi/otel-recipes/tree/main/src/java/trace/springboot-api",
  "steps": [
    {
      "displayName": "Add the Spring Boot Starter dependency",
      "order": 1,
      "source": "https://raw.githubusercontent.com/joaopgrassi/otel-recipes/main/src/java/trace/springboot-api/build.gradle#L23-L27"
    },
    {
      "displayName": "Create a span",
      "order": 2,
      "source": "https://raw.githubusercontent.com/joaopgrassi/otel-recipes/main/src/java/trace/springboot-api/src/main/java/com/otel/recipes/springbootapi/HelloWorldController.java#L26"
    }
  ],
  "dependencies": [
    {
      "id": "io.opentelemetry:opentelemetry-bom",
      "version": "1.36.0"
    },
    {
      "id": "io.opentelemetry:opentelemetry-api",
      "version": "1.36.0"
    },
    {
      "id": "io.opentelemetry.instrumentation:opentelemetry-instrumentation-bom-alpha",
      "version": "2.2.0-alpha"
    },
    {
      "id": "io.opentelemetry.instrumentation:opentelemetry-spring-boot-starter",
      "version": "2.2.0-alpha"
    }
  ]
}
