{
  "$schema": "../../../../otel-recipes-schema.json",
  "id": "java.console.traces",
  "languageId": "java",
  "signal": "traces",
  "displayName": "Console App",
  "tags": [],
  "description": "A Java console application instrumented with OpenTelemetry that generates a trace.",
  "sourceRoot": "https://github.com/joaopgrassi/otel-recipes/tree/main/src/java/trace/console",
  "steps": [
    {
      "displayName": "Configure the SDK",
      "order": 1,
      "source": "https://raw.githubusercontent.com/joaopgrassi/otel-recipes/main/src/java/trace/console/app/src/main/java/otel/recipes/App.java"
    }
  ],
  "dependencies": [
    {
      "id": "io.opentelemetry:opentelemetry-bom",
      "version": "1.36.0"
    },
    {
      "id": "io.opentelemetry:opentelemetry-api",
      "version": "1.36.0"
    },
    {
      "id": "io.opentelemetry:opentelemetry-exporter-otlp",
      "version": "1.36.0"
    },
    {
      "id": "io.opentelemetry:opentelemetry-sdk",
      "version": "1.36.0"
    },
    {
      "id": "io.opentelemetry.semconv:opentelemetry-semconv",
      "version": "1.23.1-alpha"
    }
  ]
}
