{
  "$schema": "../../../../otel-recipes-schema.json",
  "id": "js.console.traces",
  "languageId": "js",
  "signal": "traces",
  "displayName": "Console App",
  "tags": [],
  "description": "A nodejs console application instrumented with OpenTelemetry that generates a trace.",
  "sourceRoot": "https://github.com/joaopgrassi/otel-recipes/tree/main/src/js/trace/console",
  "steps": [
    {
      "displayName": "Configure the SDK",
      "order": 1,
      "source": "https://raw.githubusercontent.com/joaopgrassi/otel-recipes/main/src/js/trace/console/app.js"
    }
  ],
  "dependencies": [
    {
      "id": "@opentelemetry/api",
      "version": "^1.8.0"
    },
    {
      "id": "@opentelemetry/sdk-trace-base",
      "version": "^1.23.0"
    },
    {
      "id": "@opentelemetry/exporter-trace-otlp-grpc",
      "version": "^0.50.0"
    },
    {
      "id": "@opentelemetry/semantic-conventions",
      "version": "1.23.0"
    }
  ]
}
